id,server,secret,title,tags,views,description,date_taken,latitude,longitude,url_s,owner_name,owner,media
53793841700,65535,60e573680d,Me Myself & my Shadow,shadows venice italy clouds girl 1person mobile water ocean seaside bitta pilone banchina waiting shadow alone lonlyness sky canon blue cirrus womanphotographer,6616,"Also in Venice it's possible to  get some lonely rest, away from the overtourism.  Who knows maybe she was waiting for someone, but for sure she was getting a lot of space around her in Venice.",2023-11-22 13:41:25,45.433427,12.340808,https://live.staticflickr.com/65535/53793841700_60e573680d_m.jpg,! . Angela Lobefaro . !,89441939@N00,photo
52610993731,65535,abfdf198d6,Waiting for clients,europe italia italien italy veneto venetien venedig venezia venice sanmarco durchgang durchlass gang sotopotego piazzasanmarco markusplatz st marks square prostitution freier clients warten waiting sexarbeiterin frau sw schwarzweis bw blackwhite blackandwhite whiteandblack nb noiretblanc monochrome wolframbiermannzeitler,3480,"Sotopotego e calle del cappello nero at St Mark's Square in Venice (San Marco) A sotoportego is a footpath in Venice that passes under a building, occasionally just under an arch. This form of passage or subway dates back to the time of the Republic of Venice and exists with this designation only in this city. Veneto, Italy 11.08.2021  Warten auf Kundschaft Sotopotego e calle del cappello nero am Markusplatz in Venedig (San Marco) Ein Sotoportego ist ein Fußweg in Venedig, der unter einem Gebäude, gelegentlich auch nur unter einem Bogen, hindurchführt. Diese Form des Durchgangs oder der Unterführung stammt aus der Zeit der Republik Venedig und existiert mit dieser Bezeichnung auch nur in dieser Stadt. Venetien, Italien 11.08.2021",2021-08-11 00:35:38,45.434825,12.338676,https://live.staticflickr.com/65535/52610993731_abfdf198d6_m.jpg,Wolfram Biermann-Zeitler,147123366@N06,photo
53793841700,65535,60e573680d,Me Myself & my Shadow,shadows venice italy clouds girl 1person mobile water ocean seaside bitta pilone banchina waiting shadow alone lonlyness sky canon blue cirrus womanphotographer,6616,"Also in Venice it's possible to  get some lonely rest, away from the overtourism.  Who knows maybe she was waiting for someone, but for sure she was getting a lot of space around her in Venice.",2023-11-22 13:41:25,45.433427,12.340808,https://live.staticflickr.com/65535/53793841700_60e573680d_m.jpg,! . Angela Lobefaro . !,89441939@N00,photo
52610993731,65535,abfdf198d6,Waiting for clients,europe italia italien italy veneto venetien venedig venezia venice sanmarco durchgang durchlass gang sotopotego piazzasanmarco markusplatz st marks square prostitution freier clients warten waiting sexarbeiterin frau sw schwarzweis bw blackwhite blackandwhite whiteandblack nb noiretblanc monochrome wolframbiermannzeitler,3480,"Sotopotego e calle del cappello nero at St Mark's Square in Venice (San Marco) A sotoportego is a footpath in Venice that passes under a building, occasionally just under an arch. This form of passage or subway dates back to the time of the Republic of Venice and exists with this designation only in this city. Veneto, Italy 11.08.2021  Warten auf Kundschaft Sotopotego e calle del cappello nero am Markusplatz in Venedig (San Marco) Ein Sotoportego ist ein Fußweg in Venedig, der unter einem Gebäude, gelegentlich auch nur unter einem Bogen, hindurchführt. Diese Form des Durchgangs oder der Unterführung stammt aus der Zeit der Republik Venedig und existiert mit dieser Bezeichnung auch nur in dieser Stadt. Venetien, Italien 11.08.2021",2021-08-11 00:35:38,45.434825,12.338676,https://live.staticflickr.com/65535/52610993731_abfdf198d6_m.jpg,Wolfram Biermann-Zeitler,147123366@N06,photo
52249751522,65535,4edd8da294,A Gondolier Awaits,streetphotography venezia venice italia male gondolier waiting,1451,"Grand Canal, Venice",2022-06-21 10:27:13,45.437211,12.333888,https://live.staticflickr.com/65535/52249751522_4edd8da294_m.jpg,FotoFling Scotland,11451860@N08,photo
51697435463,65535,29144fcb45,Waiting to be sold,waiting sold aspettando vendute maschere masks cappelli hats oggettistica objects souvenirs ricordi walk venice venezia veneto laguna lagoon canali acqua boats barche calle water canals gondola cityscape paesaggiourbano bancarella stall marioottaviani sony sonyimages sonyimage sonyalpha sonyalphaclub sonyalphasclub sonyalphauniverse bealpha sonyusers sonyalphapro discoverwithalpha photographylovers photographysouls picoftheday pictureoftheday magicpict natgeoyourshot outdoorphotography earthescope natgeotravel planetdiscovery travel scenic italia italy viaggio trip exploration esplorazione,1287,Sony a7rII | Sony FE 55mm 1.8 ZA,2018-10-14 16:58:52,45.434042,12.338354,https://live.staticflickr.com/65535/51697435463_29144fcb45_m.jpg,Mario Ottaviani Photography,54945580@N04,photo
51289421996,65535,034cd28b7f,venice,italy italia venezia venice laguna lagoon canal grande old couple man woman pigeon uomo donna coppia piccione bench panchina loneliness solitudine bag seat seated seating isola island wait waiting attesa attendere water acqua san giorgio panorama landscape paesaggio romantico tourist turista romantic love honeymoon luna di miele family married sad sadness watching looking future futuro age vecchiaia oldness retirement pensionato pensioner canon 5dmarkii bw black white bianco nero,6951,,2010-09-05 15:22:32,45.431789,12.351357,https://live.staticflickr.com/65535/51289421996_034cd28b7f_m.jpg,Roberto.Trombetta,29370225@N03,photo
48715362517,65535,446e82de1b,Waiting for clients,waitingforcustomers waiting aspettando gondole gondols venezia venedig venice gondolieri gondoliers guys men maschi uomini summer sommer estate,16238,,2019-07-01 15:50:53,45.434252,12.336766,https://live.staticflickr.com/65535/48715362517_446e82de1b_m.jpg,mikael_on_flickr,16918945@N06,photo
46848545684,7890,072b922a7b,R,red rosso girl ragazza woman donna venice venezia italy italia art arte culture cultura waiting aspettare attesa sea mare sun sole boats barche canal grande channel biennale,899,,2019-03-22 13:18:34,45.431150,12.334814,https://live.staticflickr.com/7890/46848545684_072b922a7b_m.jpg,Chiaro Chiari,152939044@N05,photo
47306111142,7814,944ac825d9,IMGP5013 Tired !,piazzasanmarco venezia sanmarcosquare venice italia people street portrait resting sitting waiting pentax pentaxk3ii pentaxcamera pentaxart pentaxlens pentax18135 tired palazzoducale,1305,"Piazza San Marco, Venezia",2019-03-08 17:33:49,45.433713,12.339869,https://live.staticflickr.com/7814/47306111142_944ac825d9_m.jpg,Claudio e Lucia Images around the world,137129299@N07,photo
47306102102,7862,359761ff8e,IMGP5247 Selfie time,piazzasanmarco venezia sanmarcosquare venice italia people street portrait resting sitting waiting pentax pentaxk3ii pentaxcamera pentaxart pentaxlens pentax18135 selfie red woman womaninred selfies,1437,"Piazza San Marco, Venezia",2019-03-09 17:47:41,45.433291,12.340180,https://live.staticflickr.com/7862/47306102102_359761ff8e_m.jpg,Claudio e Lucia Images around the world,137129299@N07,photo
46431762855,7852,d8cdacd51b,IMGP4966 The gondolier is waiting,venice venezia italia people street portrait gondola gondoliere resting sitting waiting pentax pentaxk3ii pentaxcamera pentaxart pentaxlens pentax18135 gondolier,1794,Venice,2019-03-08 14:25:38,45.445463,12.326558,https://live.staticflickr.com/7852/46431762855_d8cdacd51b_m.jpg,Claudio e Lucia Images around the world,137129299@N07,photo
35839914885,4210,1448d2eae1,Aspettando,waiting aspettare wait aspettando venezia venice veneto venetian veneziano gondola barca boat canale stretto italy italia bella teal orange colori colour bello light lights reflex riflesso photo foto fotografia photography me io,652,                               ,2017-07-08 20:39:52,45.433876,12.342227,https://live.staticflickr.com/4210/35839914885_1448d2eae1_m.jpg,Stefano Girgenti,150006850@N07,photo
34795210053,4229,1068c9357c,"waiting • venice, italy • 2016",minolta autocord waiting attente vaporeto woman femme venice venise venezia italy italia italie,2758,"extrait du livre &quot;Venezia e la sua laguna&quot;, disponible <a href=""http://lemsgarage.tictail.com/"" rel=""nofollow"">ici</a>.  from the book &quot;Venezia e la sua laguna&quot; available <a href=""http://lemsgarage.tictail.com/"" rel=""nofollow"">here</a>.  <a href=""http://www.facebook.com/lemphoto"" rel=""nofollow"">lem's facebook</a>  ",2017-06-29 08:15:03,45.431694,12.328441,https://live.staticflickr.com/4229/34795210053_1068c9357c_m.jpg,lem's,99679294@N00,photo
35839914885,4210,1448d2eae1,Aspettando,waiting aspettare wait aspettando venezia venice veneto venetian veneziano gondola barca boat canale stretto italy italia bella teal orange colori colour bello light lights reflex riflesso photo foto fotografia photography me io,652,                               ,2017-07-08 20:39:52,45.433876,12.342227,https://live.staticflickr.com/4210/35839914885_1448d2eae1_m.jpg,Stefano Girgenti,150006850@N07,photo
34795210053,4229,1068c9357c,"waiting • venice, italy • 2016",minolta autocord waiting attente vaporeto woman femme venice venise venezia italy italia italie,2758,"extrait du livre &quot;Venezia e la sua laguna&quot;, disponible <a href=""http://lemsgarage.tictail.com/"" rel=""nofollow"">ici</a>.  from the book &quot;Venezia e la sua laguna&quot; available <a href=""http://lemsgarage.tictail.com/"" rel=""nofollow"">here</a>.  <a href=""http://www.facebook.com/lemphoto"" rel=""nofollow"">lem's facebook</a>  ",2017-06-29 08:15:03,45.431694,12.328441,https://live.staticflickr.com/4229/34795210053_1068c9357c_m.jpg,lem's,99679294@N00,photo
28203932443,8636,a16550b7c3,O Sole Mio,people gondola waiting night,937,The lonely gondolier waits for customers in Venice,2016-06-28 05:51:33,45.433228,12.339792,https://live.staticflickr.com/8636/28203932443_a16550b7c3_m.jpg,layzbonez,79412463@N07,photo
26242180416,1520,4241bb9387,The wait,venice people italy nikon waiting scene d750 wait tamron venise venezia venedig italie palazzoducale dogespalace 2470mm wenecja wlochy palaisdesdoges sizun czekac tamron2470mmf28 czekajac sizuneye palacdozow,2904,Waiting in front of the Doge's Palace in Venice.,2016-03-02 13:47:12,45.433356,12.339996,https://live.staticflickr.com/1520/26242180416_4241bb9387_m.jpg,Sizun Eye,99114600@N08,photo
30413774740,5564,8eb0e3ca2f,Waiting For Passengers,canonef70200mm14l canoneos5dmarkiii candid gondolier gondoliere italien italy people streetphotography venedig venezia venice waiting warten,929,Gondolier in Venice,2016-10-08 12:04:54,45.438275,12.330272,https://live.staticflickr.com/5564/30413774740_8eb0e3ca2f_m.jpg,Cornelli2010,50155751@N08,photo
28433702983,8774,3205db31fd,Week 31 of 2016 - Venice Gondolier,italy venice gondolier canals gondola waiting,430,,2016-08-04 14:43:55,45.435690,12.334427,https://live.staticflickr.com/8774/28433702983_3205db31fd_m.jpg,PabloClavo,54770037@N08,photo
25439950121,1711,7a528de59c,Servizio Gondole,italien venice italy waiting italia it d750 venezia venedig gondolier veneto wartend gondoliere,131,,2016-02-25 11:31:22,45.433158,12.339913,https://live.staticflickr.com/1711/25439950121_7a528de59c_m.jpg,swissgoldeneagle,57445335@N00,photo
24293611124,1592,9521457f33,Waiting,venice italy building stairs waiting italia wait rest resting venezia veneto,285,"Venice, Italy",2015-08-29 14:36:57,45.433371,12.330458,https://live.staticflickr.com/1592/24293611124_9521457f33_m.jpg,generatorrr,41322435@N00,photo
26186216315,65535,d3e7c48a95,"Venice Street Life, Calle Salvadago, Venice, Italy.",venice italy hardrockcafe canon 5d mkiii ef1635mm f4l street people travel amcphotography wallpaper human water waiting life hardrock adobeelements pov italian monochrome bw,2536,Waiting for a table at the Hard Rock Cafe - Venice,2015-04-06 14:06:34,45.433853,12.337176,https://live.staticflickr.com/65535/26186216315_d3e7c48a95_m.jpg,aclark1964,98231673@N06,photo
24293611124,1592,9521457f33,Waiting,venice italy building stairs waiting italia wait rest resting venezia veneto,285,"Venice, Italy",2015-08-29 14:36:57,45.433371,12.330458,https://live.staticflickr.com/1592/24293611124_9521457f33_m.jpg,generatorrr,41322435@N00,photo
23645329541,5811,fcaa32be6a,Waiting for the Vaporetto,venice roses italy reflection men bag beard women waiting tshirt mickey jacket torn minnie venezia shoppingbag vaporetto veneto welldressed lenational 105713 rialtomercato,926,at Rialto Mercato.,2015-09-20 15:06:25,45.439480,12.335153,https://live.staticflickr.com/5811/23645329541_fcaa32be6a_m.jpg,UrbanphotoZ,50133770@N06,photo
18191745088,541,e37dc7741e,The eyes are useless when the mind is blind.,road trip travel bridge venice boy sky italy woman detail art love youth project river outside photography lights daylight town eyes nikon focus waiting day natural walk quality details joy young lifestyle romance symmetry explore relationship talent romantic moment emotional emotions venezia sighs routine earlyevening architectonic ypsilon explored architectyre emptyroads tounel d7100 momentofcreation thecenterofthetown pulchamores ypsilonepsilon ypsiloepsilon,6314,,2015-04-22 18:23:46,45.433718,12.340929,https://live.staticflickr.com/541/18191745088_e37dc7741e_m.jpg,Βαγγελης Καρακωστας,67942663@N04,photo
18191745088,541,e37dc7741e,The eyes are useless when the mind is blind.,road trip travel bridge venice boy sky italy woman detail art love youth project river outside photography lights daylight town eyes nikon focus waiting day natural walk quality details joy young lifestyle romance symmetry explore relationship talent romantic moment emotional emotions venezia sighs routine earlyevening architectonic ypsilon explored architectyre emptyroads tounel d7100 momentofcreation thecenterofthetown pulchamores ypsilonepsilon ypsiloepsilon,6314,,2015-04-22 18:23:46,45.433718,12.340929,https://live.staticflickr.com/541/18191745088_e37dc7741e_m.jpg,Βαγγελης Καρακωστας,67942663@N04,photo
17179610725,7680,c11a1e52d8,Waiting for the sunset,venice sunset italy water boat waiting barca tramonto festa venezia attesa redentore,2446,Attesa in occasione della festa del Redentore a Venezia,2014-07-19 20:18:24,45.440320,12.321381,https://live.staticflickr.com/7680/17179610725_c11a1e52d8_m.jpg,Andrea S. Costa,132626623@N06,photo
16167924857,7337,b0054f6f67,Servizio Gondole,venice sunset water costume san waiting lagoon lampost venezia gondoliers gondolas sangiorgiomaggiore serviziogondole stripedjumpers gondoliersinhats,768,Gondoliers for hire. ,2015-01-13 10:53:25,45.433771,12.342288,https://live.staticflickr.com/7337/16167924857_b0054f6f67_m.jpg,moggsterb,19994691@N00,photo
15853157026,7571,db7e4f3565,waiting,venice autumn people italy colors girl beautiful smile canon 50mm model waiting warm italia young venezia ritratto sanmarco bellezza ragazza 1100d,2880,,2014-11-21 11:53:25,45.440320,12.321381,https://live.staticflickr.com/7571/15853157026_db7e4f3565_m.jpg,Carola Cappellari,79000412@N04,photo
15322088382,3911,07a7fb607f,Venice Gondalas,blue venice italy water vertical boat waiting europe italia waves 5 panoramic pole vehicles parked venezia selectivecolour ledro trentinoaltoadigesüdtirol,1396,"Gondalas waiting for tourists, Venice, Italy.",2010-08-03 12:26:17,45.433341,12.340050,https://live.staticflickr.com/3911/15322088382_07a7fb607f_m.jpg,John Fÿn Photography,85907303@N08,photo
9783728553,3677,e00e75c98b,"Venezia Marzo 2013, stazione dei treni",venice train waiting trainstation venedig waitingforthetrain venicestation stazionedivenezia,80,,2013-03-03 17:22:52,45.441405,12.320244,https://live.staticflickr.com/3677/9783728553_e00e75c98b_m.jpg,Dage - Looking For Europe,64552256@N08,photo
9510272745,3779,9d635961cc,Venice-gondoliers,venice italy texture waiting venezia gondoliers gondols aviana2 yahoo:yourpictures=work,8777,Italy ,2012-09-14 11:12:23,45.433755,12.343525,https://live.staticflickr.com/3779/9510272745_9d635961cc_m.jpg,aviana2,7183402@N03,photo
8580213835,8245,6a1eb0d864,Sala d'attesa,city venice people blackandwhite panorama blancoynegro blanco waiting gente streetphotography venise venezia bianco blanc nero biancoenero città attesa blancetnoir aspettare,100,,2013-03-17 11:48:27,45.433833,12.345166,https://live.staticflickr.com/8245/8580213835_6a1eb0d864_m.jpg,cristina morello,91388535@N05,photo
8701659809,8258,306f996c1e,Gondoliere in attesa a Rialto,bridge venice man tourism veneza puente nikon waiting sitting que ponte uomo sentado getty pont mann brücke venise turismo esperando venezia homem venedig espera hombre rialto assis qui tourismus gondolier gondolas homme gettyimages tourisme attesa wartet d90 sitzt seduto gondoliere gondoleiro венеция моста ожидания человека attendait гондольер paolobis туризма сидящего,1379,"<b> See other pictures of SET...  <a href=""http://www.flickr.com/photos/paolobis/sets/72157594492557930/with/8113798116/"">VENEZIA E LA SUA LAGUNA </a> </b>  <b> Tutte le foto  -   All  photo   <a href=""http://darckr.com/username?username=PaoloBis"" rel=""nofollow"">  [ from PaoloBis ] </a> </b>",2013-05-01 08:33:18,45.438152,12.335672,https://live.staticflickr.com/8258/8701659809_306f996c1e_m.jpg,PaoloBis,61273381@N00,photo
8580213835,8245,6a1eb0d864,Sala d'attesa,city venice people blackandwhite panorama blancoynegro blanco waiting gente streetphotography venise venezia bianco blanc nero biancoenero città attesa blancetnoir aspettare,100,,2013-03-17 11:48:27,45.433833,12.345166,https://live.staticflickr.com/8245/8580213835_6a1eb0d864_m.jpg,cristina morello,91388535@N05,photo
8316026617,8079,e09a8144d2,A Year Ago Today,bridge venice italy reflection water boats canal italian waiting italia memories return venetian venise venezia venedig soon sancroce 2013 ayearagotoday rachaelmc aloveofvenice rjmcdiarmid,164,Missing Venice way too much!  2013 we will return to La Serenissima for the sixth time but unfortunately it's too early to start the countdown!,2011-12-28 23:34:39,45.438784,12.323532,https://live.staticflickr.com/8079/8316026617_e09a8144d2_m.jpg,RachaelMc,8972664@N03,photo
8261667719,8502,ee371e6ef5,Esperando....,waiting venecia espera gondolero,261,Venecia,2012-10-30 16:10:07,45.434313,12.336702,https://live.staticflickr.com/8502/8261667719_ee371e6ef5_m.jpg,PABLERAS2011,58879719@N08,photo
7696506144,8018,503bd9f620,"Facade of San Giorgio Maggiore, Venice",blue venice sky people italy cloud lighthouse white church sunshine skyline facade island george waiting italia catholic sitting shadows columns steps saints statues tourists christian monastery angels monks shade cupola dome venetian christianity piazza benedictine information venezia hospitality palladio sangiorgiomaggiore benedict palladian monasticism andreapalladio renassiance simeonesorella,498,"This is where we stayed for our few days in Venice - not in the abbey church, but in the guestwing attached to it. You can just see that guestwing to the right of the photo. Benedictine hospitality can only be extolled at this particular monastery. The church and most of the monastic buildings were designed by Andrea Palladio and Simeone Sorella between 1565-97, though the monastery itself had been standing for a good six hundred years before that. ",2012-05-02 13:04:44,45.429343,12.342710,https://live.staticflickr.com/8018/7696506144_503bd9f620_m.jpg,gowersaint,29259083@N05,photo
7696472918,7107,c662ee2d5b,"Gondolier, Venice (where else?)",venice italy man male water muscles hat sunglasses reflections boat canal italian waiting italia pattern break moody embroidery handsome tshirt tourists pole business arrogant attitude crown ribbon parked job venezia gondolier venitian gilt swagger upholstery gondoler occupation boater moneymaker cigerette machio snear,1157,"According to a definition, &quot;The gondola is propelled by a person (the gondolier) who stands facing the bow and rows with a forward stroke, followed by a compensating backward stroke.&quot; During my few days in Venice it seemed to me that the main occupation of the Gondolier was to preen, pose and display, with the occasional venture onto the waters to be admired by tourists at great financial cost to the said tourists.",2012-05-02 12:24:56,45.435607,12.343504,https://live.staticflickr.com/7107/7696472918_c662ee2d5b_m.jpg,gowersaint,29259083@N05,photo
7557113232,8285,bd106046fd,Venice - the driver's view,travel venice italy man bus male water sunglasses buildings canal movement italian cabin waiting uniform steering guidance cockpit captain controls driver venetian job palazzo venezia steeringwheel grandcanal helm vaporetto occupation,481,"The vaporetto's control hub, and Venice's equivilant of a bus driver",2012-05-01 12:07:17,45.435306,12.328033,https://live.staticflickr.com/8285/7557113232_bd106046fd_m.jpg,gowersaint,29259083@N05,photo
7244380814,5272,402f0c85a8,wait on the line boat,venice winter blackandwhite bw sun sunlight silhouette nikon waiting mood noiretblanc platform citylife streetshots streetphotography atmosphere streetlife streetscene lagoon nb sw noon venezia venedig sunnyday twowomen polfilter vaporetti sanpolo nikond1h lagooncity circularfilter livinginitaly livinginvenice lineboat inthecolddays,2875,"San Polo, Venezia, Italy  <b>© Xuan-Cung Le All rights reserved</b> seen in : <a href=""http://www.flickr.com/photos/le_xuan-cung/sets/72157629388008397/"">Venice</a> <a href=""http://www.flickriver.com/photos/le_xuan-cung/"" rel=""nofollow"">recent</a> <a href=""http://www.flickriver.com/photos/le_xuan-cung/friends/"" rel=""nofollow"">contacts images</a>",2012-02-16 12:16:26,45.435630,12.330801,https://live.staticflickr.com/5272/7244380814_402f0c85a8_m.jpg,Le Xuan-Cung,39151213@N08,photo
7557113232,8285,bd106046fd,Venice - the driver's view,travel venice italy man bus male water sunglasses buildings canal movement italian cabin waiting uniform steering guidance cockpit captain controls driver venetian job palazzo venezia steeringwheel grandcanal helm vaporetto occupation,481,"The vaporetto's control hub, and Venice's equivilant of a bus driver",2012-05-01 12:07:17,45.435306,12.328033,https://live.staticflickr.com/8285/7557113232_bd106046fd_m.jpg,gowersaint,29259083@N05,photo
7244380814,5272,402f0c85a8,wait on the line boat,venice winter blackandwhite bw sun sunlight silhouette nikon waiting mood noiretblanc platform citylife streetshots streetphotography atmosphere streetlife streetscene lagoon nb sw noon venezia venedig sunnyday twowomen polfilter vaporetti sanpolo nikond1h lagooncity circularfilter livinginitaly livinginvenice lineboat inthecolddays,2875,"San Polo, Venezia, Italy  <b>© Xuan-Cung Le All rights reserved</b> seen in : <a href=""http://www.flickr.com/photos/le_xuan-cung/sets/72157629388008397/"">Venice</a> <a href=""http://www.flickriver.com/photos/le_xuan-cung/"" rel=""nofollow"">recent</a> <a href=""http://www.flickriver.com/photos/le_xuan-cung/friends/"" rel=""nofollow"">contacts images</a>",2012-02-16 12:16:26,45.435630,12.330801,https://live.staticflickr.com/5272/7244380814_402f0c85a8_m.jpg,Le Xuan-Cung,39151213@N08,photo
7104208759,7190,054f0fb43a,dreaming at Canal Grande,morning venice winter blackandwhite bw woman sun sunlight daylight nikon waiting thought mood alone noiretblanc citylife streetshots streetphotography atmosphere streetlife streetscene nb dreaming beautifulwoman sw venezia venedig impression sanmarco vn canalgrande extravagant pontedirialto lagooncity livinginitaly livinginvenice lightsanddarks characterstudies nikoncoolpixs52 inthecolddays livinginlagooncity,1155,"a beautiful woman, Ponte di Rialto, Venice Italy  <b>© Xuan-Cung Le All rights reserved</b> seen in : <a href=""http://www.flickr.com/photos/le_xuan-cung/sets/72157629388008397/"">Venice</a> <a href=""http://www.flickriver.com/photos/le_xuan-cung/"" rel=""nofollow"">recent</a> <a href=""http://www.flickriver.com/photos/le_xuan-cung/friends/"" rel=""nofollow"">contacts images</a> ",2012-02-17 09:05:20,45.437429,12.335522,https://live.staticflickr.com/7190/7104208759_054f0fb43a_m.jpg,Le Xuan-Cung,39151213@N08,photo
6921145770,5155,e857ec544b,"Gondolieri on Ponte de l'Olio, Rio del Fontego dei Tedeschi,Venice Italy",bridge venice winter blackandwhite bw sunlight lagune stairs portraits canal nikon waiting mood noiretblanc dream citylife streetshots streetphotography atmosphere streetlife streetscene lagoon nb sw noon venezia castello venedig sunnyday vn gondolieri seeyou twomen polfilter nikond1h lagooncity circularfilter livinginitaly livinginvenice lightsanddarks characterstudies inthecolddays pontedel´olio,1524,"<b>© Xuan-Cung Le All rights reserved</b> seen in : <a href=""http://www.flickr.com/photos/le_xuan-cung/sets/72157629388008397/"">Venice</a> <a href=""http://www.flickriver.com/photos/le_xuan-cung/"" rel=""nofollow"">recent</a> <a href=""http://www.flickriver.com/photos/le_xuan-cung/friends/"" rel=""nofollow"">contacts images</a> ",2012-02-13 11:33:24,45.438423,12.337099,https://live.staticflickr.com/5155/6921145770_e857ec544b_m.jpg,Le Xuan-Cung,39151213@N08,photo
